### ISSUE TITLE
Docker network latency overhead issue

### ISSUE THREAD

**Issue by paales** [ho-nl/docker-development-box#10]

**Comment by paales** [comment]
Network latency issues can be measured with:

terminal1: `sudo  tcpdump  -i lo0   dst port 3306 or src port 3306`
terminal2: `n98-magerun2 mysql` and then `SET NAMES utf8;`

Will return something like:

```
18:06:05.336145 IP localhost.54819 > localhost.mysql: Flags [P.], seq 15918:15937, ack 479387, win 7055, options [nop,nop,TS val 1048830765 ecr 1048807760], length 19
18:06:05.336174 IP localhost.mysql > localhost.54819: Flags [.], ack 15937, win 6130, options [nop,nop,TS val 1048830765 ecr 1048830765], length 0
18:06:05.338293 IP localhost.mysql > localhost.54819: Flags [P.], seq 479387:479489, ack 15937, win 6130, options [nop,nop,TS val 1048830767 ecr 1048830765], length 102
18:06:05.338325 IP localhost.54819 > localhost.mysql: Flags [.], ack 479489, win 7053, options [nop,nop,TS val 1048830767 ecr 1048830767], length 0
```

`338293-336174=002119 = 2.1ms`

Confirmed on multiple systems.

On a bare metal box:

terminal1: `tcpdump  -i lo   dst port 3306 or src port 3306`
terminal2: `mysql -p -h 127.0.0.1` and then `SET NAMES utf8;`

```
18:14:09.954134 IP localhost.19698 > localhost.mysql: Flags [P.], seq 226:245, ack 183, win 86, options [nop,nop,TS val 1359422111 ecr 1359406475], length 19
18:14:09.954304 IP localhost.mysql > localhost.19698: Flags [P.], seq 183:285, ack 245, win 86, options [nop,nop,TS val 1359422111 ecr 1359422111], length 102
18:14:09.954321 IP localhost.19698 > localhost.mysql: Flags [.], ack 285, win 86, options [nop,nop,TS val 1359422111 ecr 1359422111], length 0
```

`954321-954134=000187 =  0.1ms`

This is a 20x difference..

**Comment by paales** [comment]
Thanks to @jeroenvermeulen for helping with this issue:

Mac to Docker:
```
jeroen@Option:~$ time printf 'SET NAMES utf8;%.0s' {1..1000} | mysql -p'magento' -u'magento' -h 127.0.0.1
mysql: [Warning] Using a password on the command line interface can be insecure.
real	0m0.976s
```

Docker local TCP:
```
bash-4.2$ time printf 'SET NAMES utf8;%.0s' {1..1000} | mysql -p'magento' -u'magento' -h 127.0.0.1
mysql: [Warning] Using a password on the command line interface can be insecure.
real	0m0.281s
```

Docker lokaal Socket:
```
bash-4.2$ time printf 'SET NAMES utf8;%.0s' {1..1000} | mysql -p'magento' -u'magento' -h localhost
mysql: [Warning] Using a password on the command line interface can be insecure.
real	0m0.147s
```

Dedicated TCP
```
gereedst@star:~$ time printf 'SET NAMES utf8;%.0s' {1..1000} | mysql -p'****' -h'127.0.0.1'
mysql: [Warning] Using a password on the command line interface can be insecure.
real	0m0.085s
```

Dedicated Socket
```
gereedst@star:~$ time printf 'SET NAMES utf8;%.0s' {1..1000} | mysql -p'****' -h'localhost'
mysql: [Warning] Using a password on the command line interface can be insecure.
real	0m0.046s
```

- From Mac to Docker takes 3x as much time as locally on the Docker box.
- TCP takes about twice as long as connecting over Socket.
- Docker is about 3x as slow as dedicated hardware.
- Dedicated socket is 18x faster than Mac to Docker TCP

**Comment by paales** [comment]
The high latency situation can be detected in the frontend when running a profile and selecting the fastest query. I'd expect the fastest query to take 0.0ms or 0.1ms, but the result is 0.7ms - 1.1ms for the fastest query:

With NFS:
![Schermafbeelding 2020-06-04 om 11 38 49](https://user-images.githubusercontent.com/1244416/83741031-fa4df500-a657-11ea-945a-413e11148b9c.png)

Without NFS, data only available on docker container:
![Schermafbeelding 2020-06-04 om 11 44 41](https://user-images.githubusercontent.com/1244416/83741681-cde6a880-a658-11ea-88da-932e3ae0ebc8.png)

**Comment by paales** [comment]
Benchmarks from Anton Siniorg:

Docker TCP Local
```
time printf ‘SET NAMES utf8;%.0s’ {1..1000} | mysql -p’magento’ -u’magento’ -h localhost
mysql: [Warning] Using a password on the command line interface can be insecure.
real    0m0.202s
```

Other container to Mysql Docker TCP
```
time printf ‘SET NAMES utf8;%.0s’ {1..1000} | mysql -p’magento’ -u’magento’ -h mysql
mysql: [Warning] Using a password on the command line interface can be insecure.
real    0m0.173s
```

There is no latency overhead to communicate from container to container it seems.

**Comment by paales** [comment]
As a suggestion from Winston Nolan i've added:

```
[mysqld]
skip-host-cache
skip-name-resolve
```

This doesn't seem to be affecting the performance

**Comment by jeroenvermeulen** [comment]
I am have created a Docker container running our server install, like this one:
https://hub.docker.com/layers/magehost/ubuntu-systemd/bionic/images/sha256-9442e783dcfebcca965fe2f7728d6b562636087d74e314b69a2d247f9ad15a7b?context=repo 
This container stores the MySQL data locally, no NFS or other mount.

Performance is a bit better then [the results](https://github.com/ho-nl/docker-development-box/issues/10#issuecomment-638677595) of my tests on the 'docker-development-box'.

Mac to MH Docker TCP
```
jeroen@Option:~$ time printf 'SET NAMES utf8;%.0s' {1..1000} | mysql -p'magento' -u'magento' -h 127.0.0.1 -P3307
real	0m0.995s
```
MH Docker local TCP
```
root@30d86f0db641:/# time printf 'SET NAMES utf8;%.0s' {1..1000} | mysql -p'magento' -u'magento' -h 127.0.0.1
real	0m0.188s
```
MH Docker local Socket
```
time printf 'SET NAMES utf8;%.0s' {1..1000} | mysql -p'magento' -u'magento' -h localhost
real	0m0.125s
```

I executed the test multiple times, these results are around the average.

Conclusion: Although inside the Docker container this image may be a bit faster, MySQL: from Mac to Docker is still way slower. I will probably investigate furter later.

**Comment by paales** [comment]
Using mutagen port forwarding:
`mutagen forward create tcp:localhost:3306 docker://root@project-waardijknl_mysql_1:tcp:localhost:3306`

No difference (can't get `time` to properly print)

Using mutagen socket forwarding:
`mutagen forward create unix:./var/mysql.sock docker://root@project-waardijknl_mysql_1:unix:/var/lib/mysql/mysql.sock`

No difference (can't get `time` to properly print)

**Comment by paales** [comment]
When running Docker 2.1.0.1:

![Schermafbeelding 2020-06-05 om 11 30 59](https://user-images.githubusercontent.com/1244416/83861479-eb7f4500-a720-11ea-9ef3-916a21b635d4.png)

Here you can see that the fastest query is about twice as fast.

**Comment by paales** [comment]
Docker latest:

```
5.34s 4.81s 4.37s 4.72s
Query Latency: 0.9
```

![Screenshot 2020-06-05 at 11 53 26](https://user-images.githubusercontent.com/1244416/83864468-110e4d80-a725-11ea-8d10-dd8dad78d3fa.png)

Docker 2.1.0.1:
```
3.68s 4.26s 3.98s 3.69s 3,73s 4,01s
Query Latency: 0.6
```
![Screenshot 2020-06-05 at 12 06 20](https://user-images.githubusercontent.com/1244416/83864483-14a1d480-a725-11ea-90eb-6ef5224debc2.png)

**Comment by paales** [comment]
Latency issue addressed in https://github.com/ho-nl/docker-development-box/releases/tag/v2.0.0
